{
  "mode": "evidence",
  "title": "What is stonewalling?",
  "question": "Why does leaving without a word make the other person feel rejected?",
  "paragraphs": [
    [
      {
        "id": "observation",
        "text": "Psychologist John Gottman and his colleagues recorded couples talking and followed them for 14 years."
      },
      {
        "id": "prediction",
        "text": "How the couples talked, together with how satisfied they were, predicted divorce with 93% accuracy."
      },
      {
        "id": "signals",
        "text": "They named four behaviours that signal a break-up."
      },
      {
        "id": "horsemen",
        "text": "The four horsemen are criticism, defensiveness, contempt and stonewalling."
      }
    ],
    [
      {
        "id": "work",
        "text": "These behaviours also harm working relationships, including between a leader and their team."
      },
      {
        "id": "harm",
        "text": "Blame, contempt and stonewalling damage trust and disrupt work."
      }
    ],
    [
      {
        "id": "withdraw",
        "text": "Stonewalling means withdrawing from a conversation."
      },
      {
        "id": "actions",
        "text": "You go quiet, change the subject or leave the room.",
        "note": "This lists your actions. The question asks why the other person feels rejected."
      },
      {
        "id": "overwhelmed",
        "text": "It usually happens when you feel overwhelmed.",
        "note": "This explains your feelings. The question asks about the other person."
      },
      {
        "id": "unseen",
        "text": "The other person can't see that."
      },
      {
        "id": "ignored",
        "text": "They see you withdraw without a word and feel ignored or rejected.",
        "key": true
      }
    ]
  ]
}
